{"schema_version":1,"run_id":"phone-putaway-contract","take_id":"phone-putaway-contract","world":"phone-putaway-contract","dimension":"minecraft:overworld","build_region":{"min":{"x":485.0,"y":-1.0,"z":82.0},"max":{"x":508.0,"y":12.0,"z":99.0}},"duration_ticks":200,"actors":[{"actor_id":"CH02","player_name":"PutAwayZhou","skin_ref":"classmate:zhou","start":{"x":494.5,"y":0.0,"z":90.5},"yaw":0.0,"pitch":0.0,"steps":[{"start_tick":0,"duration_ticks":60,"action":"phone_sit"},{"start_tick":60,"duration_ticks":40,"action":"phone_putaway_sit"},{"start_tick":100,"duration_ticks":100,"action":"sit"}]}]}
