{
  "schema_version": 1,
  "run_id": "v11-dialogue-20261029a",
  "take_id": "v11-dialogue-20261029a-actors",
  "world": "KJDS_v11_dialogue_20261029a",
  "dimension": "minecraft:overworld",
  "build_region": {
    "min": {
      "x": 511.0,
      "y": 0.0,
      "z": 108.0
    },
    "max": {
      "x": 533.0,
      "y": 7.0,
      "z": 119.0
    }
  },
  "duration_ticks": 200,
  "actors": [
    {
      "actor_id": "CH04",
      "player_name": "S02Worker",
      "start": {
        "x": 517.63,
        "y": 1.0,
        "z": 116.56
      },
      "yaw": 0.0,
      "pitch": 0.0,
      "skin_ref": "classmate:chen",
      "steps": [
        {
          "start_tick": 0,
          "duration_ticks": 40,
          "action": "phone_sit"
        },
        {
          "start_tick": 40,
          "duration_ticks": 160,
          "action": "sit"
        }
      ],
      "mouth_frames": [
        0,
        0,
        0,
        0,
        0,
        0,
        0,
        0,
        0,
        0,
        0,
        0,
        1,
        1,
        2,
        2,
        1,
        1,
        2,
        2,
        2,
        2,
        0,
        0,
        2,
        2,
        2,
        2,
        1,
        1,
        1,
        1,
        1,
        1,
        1,
        1,
        2,
        2,
        0,
        0,
        0,
        0,
        0,
        0,
        0,
        0,
        0,
        0,
        0,
        0,
        0,
        0,
        0,
        0,
        0,
        0,
        0,
        0,
        0,
        0,
        0,
        0,
        0,
        0,
        0,
        0,
        0,
        0,
        0,
        0,
        0,
        0,
        0,
        0,
        0,
        0,
        0,
        0,
        0,
        0,
        0,
        0,
        0,
        0,
        0,
        0,
        0,
        0,
        0,
        0,
        0,
        0,
        0,
        0,
        0,
        0,
        0,
        0,
        0,
        0,
        0,
        0,
        0,
        0,
        0,
        0,
        0,
        0,
        0,
        0,
        0,
        0,
        0,
        0,
        0,
        0,
        0,
        0,
        0,
        0,
        0,
        0,
        0,
        0,
        0,
        0,
        0,
        0,
        0,
        0,
        0,
        0,
        0,
        0,
        0,
        0,
        0,
        0,
        0,
        0,
        0,
        0,
        0,
        0,
        0,
        0,
        0,
        0,
        0,
        0,
        0,
        0,
        0,
        0,
        0,
        0,
        0,
        0,
        0,
        0,
        0,
        0,
        0,
        0,
        0,
        0,
        0,
        0,
        0,
        0,
        0,
        0,
        0,
        0,
        0,
        0,
        0,
        0,
        0,
        0,
        0,
        0,
        0,
        0,
        0,
        0,
        0,
        0,
        0,
        0,
        0,
        0,
        0,
        0,
        0,
        0,
        0,
        0,
        0,
        0
      ]
    },
    {
      "actor_id": "CH07",
      "player_name": "S02Coworker",
      "start": {
        "x": 519.5,
        "y": 1.0,
        "z": 116.5
      },
      "yaw": 90.0,
      "pitch": 0.0,
      "skin_ref": "classmate:safety",
      "steps": [
        {
          "start_tick": 0,
          "duration_ticks": 160,
          "action": "phone"
        },
        {
          "start_tick": 160,
          "duration_ticks": 40,
          "action": "idle"
        }
      ],
      "mouth_frames": [
        0,
        0,
        0,
        0,
        0,
        0,
        0,
        0,
        0,
        0,
        0,
        0,
        0,
        0,
        0,
        0,
        0,
        0,
        0,
        0,
        0,
        0,
        0,
        0,
        0,
        0,
        0,
        0,
        0,
        0,
        0,
        0,
        0,
        0,
        0,
        0,
        0,
        0,
        0,
        0,
        0,
        0,
        0,
        0,
        0,
        0,
        0,
        0,
        0,
        0,
        0,
        0,
        0,
        0,
        0,
        0,
        0,
        0,
        0,
        0,
        0,
        0,
        0,
        0,
        0,
        0,
        0,
        0,
        0,
        0,
        1,
        1,
        2,
        2,
        2,
        2,
        2,
        2,
        2,
        2,
        1,
        1,
        0,
        0,
        0,
        0,
        2,
        2,
        1,
        1,
        1,
        1,
        2,
        2,
        2,
        2,
        2,
        2,
        1,
        1,
        1,
        1,
        2,
        2,
        1,
        1,
        1,
        1,
        1,
        1,
        0,
        0,
        0,
        0,
        0,
        0,
        0,
        0,
        0,
        0,
        0,
        0,
        0,
        0,
        0,
        0,
        0,
        0,
        0,
        0,
        0,
        0,
        0,
        0,
        0,
        0,
        0,
        0,
        0,
        0,
        0,
        0,
        0,
        0,
        0,
        0,
        0,
        0,
        0,
        0,
        0,
        0,
        0,
        0,
        0,
        0,
        0,
        0,
        0,
        0,
        0,
        0,
        0,
        0,
        0,
        0,
        0,
        0,
        0,
        0,
        0,
        0,
        0,
        0,
        0,
        0,
        0,
        0,
        0,
        0,
        0,
        0,
        0,
        0,
        0,
        0,
        0,
        0,
        0,
        0,
        0,
        0,
        0,
        0,
        0,
        0,
        0,
        0,
        0,
        0
      ]
    }
  ]
}
