{"schema_version":1,"run_id":"push-contract","take_id":"push-contract","world":"push-contract","dimension":"minecraft:overworld","build_region":{"min":{"x":485.0,"y":-1.0,"z":82.0},"max":{"x":508.0,"y":12.0,"z":99.0}},"duration_ticks":120,"actors":[{"actor_id":"CH04","player_name":"PushWorker","skin_ref":"classmate:chen","start":{"x":493.5,"y":0.0,"z":88.5},"yaw":-90.0,"pitch":0.0,"steps":[{"start_tick":0,"duration_ticks":40,"action":"idle"},{"start_tick":40,"duration_ticks":10,"action":"push_actor","actor_ref":"CH05"},{"start_tick":50,"duration_ticks":70,"action":"idle"}]},{"actor_id":"CH05","player_name":"PushElder","skin_ref":"classmate:elder","start":{"x":494.5,"y":0.0,"z":88.5},"yaw":0.0,"pitch":0.0,"steps":[{"start_tick":0,"duration_ticks":50,"action":"idle"},{"start_tick":50,"duration_ticks":40,"action":"recoil_to","target":{"x":494.5,"y":0.0,"z":90.0},"timeout_ticks":40},{"start_tick":90,"duration_ticks":30,"action":"idle"}]}]}
