{"schema_version":1,"run_id":"coat-contract","take_id":"coat-contract","world":"coat-contract","dimension":"minecraft:overworld","build_region":{"min":{"x":390.0,"y":3.0,"z":150.0},"max":{"x":414.0,"y":10.0,"z":174.0}},"duration_ticks":200,"actors":[{"actor_id":"CH01","player_name":"CoatA","skin_ref":"classmate:a","start":{"x":400.0,"y":4.0,"z":154.55},"yaw":180.0,"pitch":0.0,"steps":[{"start_tick":0,"duration_ticks":40,"action":"phone"},{"start_tick":40,"duration_ticks":80,"action":"pickup_coat","target":{"x":399.55,"y":5.13,"z":153.98}},{"start_tick":120,"duration_ticks":80,"action":"hold_coat"}]}]}
