{"schema_version":1,"run_id":"phone-stop-contract","take_id":"phone-stop-contract","world":"phone-stop-contract","dimension":"minecraft:overworld","build_region":{"min":{"x":485.0,"y":-1.0,"z":82.0},"max":{"x":508.0,"y":12.0,"z":99.0}},"duration_ticks":200,"actors":[{"actor_id":"CH06","player_name":"StopFilmer","skin_ref":"classmate:filmer","start":{"x":494.5,"y":0.0,"z":90.5},"yaw":0.0,"pitch":0.0,"steps":[{"start_tick":0,"duration_ticks":60,"action":"phone"},{"start_tick":60,"duration_ticks":40,"action":"phone_stop"},{"start_tick":100,"duration_ticks":100,"action":"idle"}]}]}
