{"schema_version":1,"run_id":"phone-place-contract","take_id":"phone-place-contract","world":"phone-place-contract","dimension":"minecraft:overworld","build_region":{"min":{"x":511.0,"y":0.0,"z":108.0},"max":{"x":533.0,"y":7.0,"z":119.0}},"duration_ticks":200,"actors":[{"actor_id":"CH04","player_name":"TableWorker","skin_ref":"classmate:chen","start":{"x":517.63,"y":1.0,"z":116.56},"yaw":0.0,"pitch":0.0,"steps":[{"start_tick":0,"duration_ticks":60,"action":"phone_call_sit"},{"start_tick":60,"duration_ticks":60,"action":"phone_place_sit","target":{"x":517.255,"y":2.025625,"z":117.17}},{"start_tick":120,"duration_ticks":80,"action":"sit"}]}]}
