{
  "schema_version": 1,
  "run_id": "v11-compact-pickup-20261029b",
  "take_id": "v11-compact-pickup-20261029b-actors",
  "world": "KJDS_v11_compact_pickup_20261029b",
  "dimension": "minecraft:overworld",
  "build_region": {
    "min": {
      "x": 485.0,
      "y": -1.0,
      "z": 82.0
    },
    "max": {
      "x": 508.0,
      "y": 12.0,
      "z": 99.0
    }
  },
  "duration_ticks": 1720,
  "actors": [
    {
      "actor_id": "elder",
      "player_name": "GroceryElder",
      "start": {
        "x": 494.5,
        "y": 0.0,
        "z": 90.0
      },
      "yaw": 0.0,
      "pitch": 0.0,
      "skin_ref": "classmate:elder",
      "steps": [
        {
          "start_tick": 0,
          "duration_ticks": 1,
          "action": "scatter_groceries",
          "target": {
            "x": 494.5,
            "y": 0.0,
            "z": 90.0
          }
        },
        {
          "start_tick": 1,
          "duration_ticks": 39,
          "action": "fall_down"
        },
        {
          "start_tick": 40,
          "duration_ticks": 60,
          "action": "stand_up"
        },
        {
          "start_tick": 100,
          "duration_ticks": 100,
          "action": "walk_to",
          "target": {
            "x": 499.0,
            "y": 0.0,
            "z": 90.0
          },
          "timeout_ticks": 100
        },
        {
          "start_tick": 200,
          "duration_ticks": 1520,
          "action": "idle"
        }
      ]
    },
    {
      "actor_id": "filmer",
      "player_name": "GroceryFilmer",
      "start": {
        "x": 497.5,
        "y": 0.0,
        "z": 92.0
      },
      "yaw": 0.0,
      "pitch": 0.0,
      "skin_ref": "classmate:filmer",
      "steps": [
        {
          "start_tick": 0,
          "duration_ticks": 40,
          "action": "phone"
        },
        {
          "start_tick": 40,
          "duration_ticks": 40,
          "action": "phone_stop"
        },
        {
          "start_tick": 80,
          "duration_ticks": 100,
          "action": "walk_to",
          "target": {
            "x": 494.5,
            "y": 0.0,
            "z": 89.6
          },
          "timeout_ticks": 100
        },
        {
          "start_tick": 180,
          "duration_ticks": 20,
          "action": "look_at",
          "target": {
            "x": 494.5,
            "y": 1.62,
            "z": 92.6
          }
        },
        {
          "start_tick": 200,
          "duration_ticks": 1520,
          "action": "pickup_groceries",
          "target": {
            "x": 494.5,
            "y": 0.0,
            "z": 90.0
          }
        }
      ]
    }
  ]
}
